{
  "id": "CLM-COL-GUATAVITA-003",
  "subject_id": "EVT-COL-GUATAVITA-OFFERINGS",
  "statement": "A lavish mass investiture ceremony at Lake Guatavita occurred substantially as described in later colonial accounts.",
  "claim_type": "interpretation",
  "epistemic_status": "disputed",
  "source_refs": [
    "SRC-COL-CAMBRIDGE-GUATAVITA-2024",
    "SRC-COL-MET-GUATAVITA-TUNJO"
  ],
  "notes": [
    "Textual tradition supports the narrative; archaeological survey favors smaller-scale offering activity."
  ]
}
