{
  "id": "CLM-GBR-LINDOW-003",
  "subject_id": "EVT-LINDOW-MAN-IRON-AGE",
  "statement": "Ritual sacrifice is one interpretation of Lindow Man's death but is not established as the historical motive by the surviving material evidence.",
  "claim_type": "interpretation",
  "epistemic_status": "disputed",
  "source_refs": ["SRC-GBR-LINDOW-BRITISH-MUSEUM-REVIEW"],
  "notes": ["Alternative violent-death contexts remain possible."]
}
