{
  "id": "CLM-COL-GUATAVITA-005",
  "subject_id": "EVT-COL-GUATAVITA-OFFERINGS",
  "statement": "The Pasca Muisca raft is traditionally interpreted as representing a chiefly investiture ceremony associated with Guatavita.",
  "claim_type": "interpretation",
  "epistemic_status": "plausible",
  "source_refs": [
    "SRC-COL-BANREP-BALSA-MUISCA",
    "SRC-COL-BANREP-HISTORIAS-OFRENDAS-2013"
  ],
  "notes": [
    "Interpretive association; not direct event provenance."
  ]
}
