{
  "id": "CLM-NOR-OSEBERG-003",
  "subject_id": "EVT-OSEBERG-SHIP-BURIAL",
  "statement": "The exact identities, relationship, and any specific magical or cultic roles of the two women cannot be established with confidence from the surviving evidence.",
  "claim_type": "interpretation",
  "epistemic_status": "indeterminate",
  "source_refs": ["SRC-NOR-OSEBERG-VIKING-HERITAGE"],
  "notes": ["High-status, royal-associated, or specialist-role interpretations remain hypotheses."]
}
