{
  "id": "CLM-COL-GUATAVITA-001",
  "subject_id": "EVT-COL-GUATAVITA-OFFERINGS",
  "statement": "Lake Guatavita functioned as a Muisca ritual shrine where small-scale offerings took place before European contact.",
  "claim_type": "event_existence",
  "epistemic_status": "strongly_supported",
  "source_refs": [
    "SRC-COL-CAMBRIDGE-GUATAVITA-2024"
  ],
  "notes": [
    "Based on archaeological survey and ethnohistorical context."
  ]
}
